Domain,Pricing,Location,SEO Title,Meta Description,Word Count,H1,Content Depth,Strongest Ranking Area,Weakest Area,Strategic Positioning
anytimemailbox.com,$9.99-29.99/month,USA/Global,"Virtual Business Address for Business Registration Needs","Transform your business with a virtual business address. Enjoy a physical address recognized for official registrations and packages.",1322,"Virtual Business Address",Medium,Global reach & brand recognition,No Singapore focus
vofficesingapore.com,$4.17/month ($50/year),Paya Lebar,"Singapore Virtual Office from S$4.17 per month!","Elevate your business with a professional virtual office in Singapore. Enjoy a registered address, mail services, free alerts, and a client portal. Start today!",2793,"Singapore Virtual Office",High,Ultra-low pricing,Non-CBD location
regus.com,$80-150+/month,Multiple CBD,"Regus | Serviced Office Space, Coworking & Virtual Offices","Our extensive global network of office space, coworking, virtual office locations and meeting rooms offers you a flexibility and choice. Get a quote today.",9427,"Office space your way.",Very High,Premium locations & global brand,High pricing
ipostal1.com,$19.99-49.99/month,USA/Global,"#1 Digital Mailbox - Over 4,000 Mailbox Locations Worldwide","Manage your mail securely with iPostal1's Digital Mailbox. We receive your mail which you can view & manage on the iPostal1 App or website. Stop mail theft and get started today!",5608,"#1 Digital Mailbox Service Worldwide",High,Technology & app features,No Singapore focus
virtualoffice.com.sg,$338+/year ($28.17/month),Singapore CBD,"Virtual Office Services From $338 Per Year Onwards","Professional virtual office services with registered business addresses in Singapore's CBD locations.",850,"Virtual Office Singapore",Low,Singapore CBD presence,Poor content depth
servcorp.com.sg,$100+/month,Premium CBD,"Virtual Offices in Singapore | First Month FREE!","Premium virtual office solutions with professional business addresses and comprehensive administrative support services.",1200,"Premium Virtual Office Solutions",Medium,Premium service quality,High pricing
voffice.com.sg,$4.75/month,Sin Ming Lane,"Virtual Office & Business Address Singapore fr $4.75 /month","Business Address in Singapore with ACRA registration support and professional mail handling services.",950,"Singapore Virtual Office & Business Address",Low,Ultra-competitive pricing,Non-premium location